"Здравствуйте! Я заметил, что ваш сервис предоставляет возможность суммаризации текстов. Однако, интересует меня, можно ли также применять его для сжатия аудиозаписей или видеофайлов? Мне было бы очень удобно иметь такую функциональность."
Добрый день! Можно ли использовать ваш сервис для автоматического создания заголовков статей или новостей?
"Привет! Я обнаружил, что при использовании вашей функции поиска, результаты отображаются в неправильном порядке. Нужно отсортировать их правильно."
"здарова, я не хочу больше платить за эту подписку. как ее отменить и деньги вернуть?"
"Здравствуйте, Мы рады пригласить вас на открытие нашей новой художественной выставки, которая состоится в следующую субботу. Это будет уникальная возможность встретиться с талантливыми художниками и насладиться их произведениями. Мы надеемся увидеть вас там!"
"Мы приглашаем вас принять участие в нашем психологическом исследовании, направленном на изучение влияния музыки на эмоциональное состояние. Ваш вклад поможет нам получить более глубокое понимание этой темы. Мы гарантируем полную конфиденциальность ваших данных."